{
  "items": [{
    "id": "e1", "type": "concert", "title": "Lunar Waves Live at Desert Pulse", "performerId": "p1", "venueId": "v1", "start": "2026-04-17T10:00:00", "end": "2026-04-17T10:50:00", "description": "Lunar Waves Live at Desert Pulse is part of the Friday programme at Solar Stage."},{
    "id": "e2", "type": "workshop", "title": "Neon Horizon Live at Desert Pulse", "performerId": "p2", "venueId": "v2", "start": "2026-04-17T11:00:00", "end": "2026-04-17T12:15:00", "description": "Neon Horizon Live at Desert Pulse is part of the Friday programme at Mirage Tent."},{
    "id": "e3", "type": "talk", "title": "Artist Talk with Desert Echo", "performerId": "p3", "venueId": "v3", "start": "2026-04-17T12:00:00", "end": "2026-04-17T12:50:00", "description": "Artist Talk with Desert Echo is part of the Friday programme at Dune Arena."},{
    "id": "e4", "type": "dj-set", "title": "Solar Nomads Live at Desert Pulse", "performerId": "p4", "venueId": "v4", "start": "2026-04-17T13:00:00", "end": "2026-04-17T13:50:00", "description": "Solar Nomads Live at Desert Pulse is part of the Friday programme at Oasis Workshop Dome."},{
    "id": "e5", "type": "concert", "title": "Mirage Bloom Live at Desert Pulse", "performerId": "p5", "venueId": "v1", "start": "2026-04-17T14:00:00", "end": "2026-04-17T14:50:00", "description": "Mirage Bloom Live at Desert Pulse is part of the Friday programme at Solar Stage."},{
    "id": "e6", "type": "workshop", "title": "Crystal Coyote Live at Desert Pulse", "performerId": "p6", "venueId": "v2", "start": "2026-04-17T15:00:00", "end": "2026-04-17T16:15:00", "description": "Crystal Coyote Live at Desert Pulse is part of the Friday programme at Mirage Tent."},{
    "id": "e7", "type": "talk", "title": "Artist Talk with Midnight Caravan", "performerId": "p7", "venueId": "v3", "start": "2026-04-17T16:00:00", "end": "2026-04-17T16:50:00", "description": "Artist Talk with Midnight Caravan is part of the Friday programme at Dune Arena."},{
    "id": "e8", "type": "dj-set", "title": "Velvet Comet Live at Desert Pulse", "performerId": "p8", "venueId": "v4", "start": "2026-04-17T17:00:00", "end": "2026-04-17T17:50:00", "description": "Velvet Comet Live at Desert Pulse is part of the Friday programme at Oasis Workshop Dome."},{
    "id": "e9", "type": "concert", "title": "Static Palms Live at Desert Pulse", "performerId": "p9", "venueId": "v1", "start": "2026-04-17T18:00:00", "end": "2026-04-17T18:50:00", "description": "Static Palms Live at Desert Pulse is part of the Friday programme at Solar Stage."},{
    "id": "e10", "type": "workshop", "title": "Golden Circuit Live at Desert Pulse", "performerId": "p10", "venueId": "v2", "start": "2026-04-17T19:00:00", "end": "2026-04-17T20:15:00", "description": "Golden Circuit Live at Desert Pulse is part of the Friday programme at Mirage Tent."},{
    "id": "e11", "type": "talk", "title": "Artist Talk with Blue Ember", "performerId": "p11", "venueId": "v3", "start": "2026-04-17T10:30:00", "end": "2026-04-17T11:20:00", "description": "Artist Talk with Blue Ember is part of the Friday programme at Dune Arena."},{
    "id": "e12", "type": "dj-set", "title": "Dustline Choir Live at Desert Pulse", "performerId": "p12", "venueId": "v4", "start": "2026-04-17T11:30:00", "end": "2026-04-17T12:20:00", "description": "Dustline Choir Live at Desert Pulse is part of the Friday programme at Oasis Workshop Dome."},{
    "id": "e13", "type": "concert", "title": "Prism Jackals Live at Desert Pulse", "performerId": "p13", "venueId": "v1", "start": "2026-04-17T12:30:00", "end": "2026-04-17T13:20:00", "description": "Prism Jackals Live at Desert Pulse is part of the Friday programme at Solar Stage."},{
    "id": "e14", "type": "workshop", "title": "Electric Saguaro Live at Desert Pulse", "performerId": "p14", "venueId": "v2", "start": "2026-04-17T13:30:00", "end": "2026-04-17T14:45:00", "description": "Electric Saguaro Live at Desert Pulse is part of the Friday programme at Mirage Tent."},{
    "id": "e15", "type": "talk", "title": "Artist Talk with The Sand Frequencies", "performerId": "p15", "venueId": "v3", "start": "2026-04-17T14:30:00", "end": "2026-04-17T15:20:00", "description": "Artist Talk with The Sand Frequencies is part of the Friday programme at Dune Arena."},{
    "id": "e16", "type": "dj-set", "title": "Nova Caravan Live at Desert Pulse", "performerId": "p16", "venueId": "v4", "start": "2026-04-17T15:30:00", "end": "2026-04-17T16:20:00", "description": "Nova Caravan Live at Desert Pulse is part of the Friday programme at Oasis Workshop Dome."},{
    "id": "e17", "type": "concert", "title": "Amber Signals Live at Desert Pulse", "performerId": "p17", "venueId": "v1", "start": "2026-04-17T16:30:00", "end": "2026-04-17T17:20:00", "description": "Amber Signals Live at Desert Pulse is part of the Friday programme at Solar Stage."},{
    "id": "e18", "type": "workshop", "title": "Wild Mesa Live at Desert Pulse", "performerId": "p18", "venueId": "v2", "start": "2026-04-17T17:30:00", "end": "2026-04-17T18:45:00", "description": "Wild Mesa Live at Desert Pulse is part of the Friday programme at Mirage Tent."},{
    "id": "e19", "type": "talk", "title": "Artist Talk with Cactus Radio", "performerId": "p19", "venueId": "v3", "start": "2026-04-17T18:30:00", "end": "2026-04-17T19:20:00", "description": "Artist Talk with Cactus Radio is part of the Friday programme at Dune Arena."},{
    "id": "e20", "type": "dj-set", "title": "Echo Atlas Live at Desert Pulse", "performerId": "p20", "venueId": "v4", "start": "2026-04-17T19:30:00", "end": "2026-04-17T20:20:00", "description": "Echo Atlas Live at Desert Pulse is part of the Friday programme at Oasis Workshop Dome."}],
  "count": 60, "page": 1, "pageSize": 20
}